{
  "session": {
    "id": "519fee17-be0c-409a-998f-10fbe6e7098f",
    "format_version": "1.1.0",
    "participant_id": "SIM-P01",
    "start_time": "2026-06-22T11:53:03.674Z",
    "end_time": "2026-06-22T11:53:03.677Z",
    "clock_origin_ms": 16.7,
    "screen_resolution": {
      "width": 1920,
      "height": 1080
    },
    "device_pixel_ratio": 1,
    "user_agent": "Sample-Generator/1.0 (Node)",
    "browser": "Unknown",
    "calibration_score": {
      "mean_error_px": 57.6,
      "std_error_px": 18
    },
    "calibration_version": "2026-04-29-debug-webgazer-01",
    "config_snapshot": {
      "clicks_per_point": 10,
      "recalibration_threshold": 250,
      "one_euro_min_cutoff": 1,
      "one_euro_beta": 0.007,
      "one_euro_d_cutoff": 1,
      "ridge_parameter": 0.005,
      "lowess_enabled": true,
      "lowess_bandwidth": 0.45,
      "bilinear_enabled": true,
      "synth_enabled": true,
      "head_compensation_enabled": true,
      "head_comp_gain": 6
    },
    "synthetic": true,
    "note": "Données simulées (generate-sample-data.js) — non issues d'un participant réel."
  },
  "raw_gaze_data": [
    {
      "x": 1224,
      "y": 548,
      "timestamp": 1782129183675,
      "t_rel_ms": 33.4
    },
    {
      "x": 1497,
      "y": 532,
      "timestamp": 1782129183675,
      "t_rel_ms": 50.1
    },
    {
      "x": 1482,
      "y": 511,
      "timestamp": 1782129183675,
      "t_rel_ms": 66.8
    },
    {
      "x": 1524,
      "y": 519,
      "timestamp": 1782129183675,
      "t_rel_ms": 83.5
    },
    {
      "x": 1495,
      "y": 519,
      "timestamp": 1782129183675,
      "t_rel_ms": 100.2
    },
    {
      "x": 1472,
      "y": 530,
      "timestamp": 1782129183675,
      "t_rel_ms": 116.9
    },
    {
      "x": 1510,
      "y": 495,
      "timestamp": 1782129183675,
      "t_rel_ms": 133.6
    },
    {
      "x": 1490,
      "y": 521,
      "timestamp": 1782129183675,
      "t_rel_ms": 150.3
    },
    {
      "x": 1516,
      "y": 520,
      "timestamp": 1782129183675,
      "t_rel_ms": 167
    },
    {
      "x": 1482,
      "y": 519,
      "timestamp": 1782129183675,
      "t_rel_ms": 183.7
    },
    {
      "x": 1497,
      "y": 503,
      "timestamp": 1782129183675,
      "t_rel_ms": 200.4
    },
    {
      "x": 1479,
      "y": 518,
      "timestamp": 1782129183675,
      "t_rel_ms": 217.1
    },
    {
      "x": 1495,
      "y": 515,
      "timestamp": 1782129183675,
      "t_rel_ms": 233.8
    },
    {
      "x": 1481,
      "y": 527,
      "timestamp": 1782129183675,
      "t_rel_ms": 250.5
    },
    {
      "x": 1224,
      "y": 492,
      "timestamp": 1782129183675,
      "t_rel_ms": 267.2
    },
    {
      "x": 958,
      "y": 448,
      "timestamp": 1782129183675,
      "t_rel_ms": 283.9
    },
    {
      "x": 709,
      "y": 472,
      "timestamp": 1782129183675,
      "t_rel_ms": 300.6
    },
    {
      "x": 695,
      "y": 444,
      "timestamp": 1782129183675,
      "t_rel_ms": 317.3
    },
    {
      "x": 699,
      "y": 442,
      "timestamp": 1782129183675,
      "t_rel_ms": 334
    },
    {
      "x": 716,
      "y": 454,
      "timestamp": 1782129183675,
      "t_rel_ms": 350.7
    },
    {
      "x": 714,
      "y": 453,
      "timestamp": 1782129183675,
      "t_rel_ms": 367.4
    },
    {
      "x": 714,
      "y": 459,
      "timestamp": 1782129183675,
      "t_rel_ms": 384.1
    },
    {
      "x": 689,
      "y": 440,
      "timestamp": 1782129183675,
      "t_rel_ms": 400.8
    },
    {
      "x": 692,
      "y": 437,
      "timestamp": 1782129183675,
      "t_rel_ms": 417.5
    },
    {
      "x": 945,
      "y": 458,
      "timestamp": 1782129183675,
      "t_rel_ms": 434.2
    },
    {
      "x": 1225,
      "y": 508,
      "timestamp": 1782129183675,
      "t_rel_ms": 450.9
    },
    {
      "x": 1456,
      "y": 540,
      "timestamp": 1782129183675,
      "t_rel_ms": 467.6
    },
    {
      "x": 1502,
      "y": 511,
      "timestamp": 1782129183675,
      "t_rel_ms": 484.3
    },
    {
      "x": 1515,
      "y": 530,
      "timestamp": 1782129183675,
      "t_rel_ms": 501
    },
    {
      "x": 1494,
      "y": 527,
      "timestamp": 1782129183675,
      "t_rel_ms": 517.7
    },
    {
      "x": 1492,
      "y": 533,
      "timestamp": 1782129183675,
      "t_rel_ms": 534.4
    },
    {
      "x": 1502,
      "y": 518,
      "timestamp": 1782129183675,
      "t_rel_ms": 551.1
    },
    {
      "x": 1513,
      "y": 508,
      "timestamp": 1782129183675,
      "t_rel_ms": 567.8
    },
    {
      "x": 1508,
      "y": 521,
      "timestamp": 1782129183675,
      "t_rel_ms": 584.5
    },
    {
      "x": 1503,
      "y": 519,
      "timestamp": 1782129183675,
      "t_rel_ms": 601.2
    },
    {
      "x": 1499,
      "y": 534,
      "timestamp": 1782129183675,
      "t_rel_ms": 617.9
    },
    {
      "x": 1495,
      "y": 540,
      "timestamp": 1782129183675,
      "t_rel_ms": 634.6
    },
    {
      "x": 1473,
      "y": 539,
      "timestamp": 1782129183675,
      "t_rel_ms": 651.3
    },
    {
      "x": 1205,
      "y": 478,
      "timestamp": 1782129183675,
      "t_rel_ms": 668
    },
    {
      "x": 973,
      "y": 444,
      "timestamp": 1782129183675,
      "t_rel_ms": 684.7
    },
    {
      "x": 707,
      "y": 444,
      "timestamp": 1782129183675,
      "t_rel_ms": 701.4
    },
    {
      "x": 703,
      "y": 452,
      "timestamp": 1782129183675,
      "t_rel_ms": 718.1
    },
    {
      "x": 706,
      "y": 463,
      "timestamp": 1782129183675,
      "t_rel_ms": 734.8
    },
    {
      "x": 682,
      "y": 468,
      "timestamp": 1782129183675,
      "t_rel_ms": 751.5
    },
    {
      "x": 688,
      "y": 447,
      "timestamp": 1782129183675,
      "t_rel_ms": 768.2
    },
    {
      "x": 703,
      "y": 456,
      "timestamp": 1782129183675,
      "t_rel_ms": 784.9
    },
    {
      "x": 690,
      "y": 420,
      "timestamp": 1782129183675,
      "t_rel_ms": 801.6
    },
    {
      "x": 707,
      "y": 458,
      "timestamp": 1782129183675,
      "t_rel_ms": 818.3
    },
    {
      "x": 718,
      "y": 459,
      "timestamp": 1782129183675,
      "t_rel_ms": 835
    },
    {
      "x": 674,
      "y": 459,
      "timestamp": 1782129183675,
      "t_rel_ms": 851.7
    },
    {
      "x": 427,
      "y": 519,
      "timestamp": 1782129183675,
      "t_rel_ms": 868.4
    },
    {
      "x": 118,
      "y": 565,
      "timestamp": 1782129183675,
      "t_rel_ms": 885.1
    },
    {
      "x": 119,
      "y": 553,
      "timestamp": 1782129183675,
      "t_rel_ms": 901.8
    },
    {
      "x": 125,
      "y": 553,
      "timestamp": 1782129183675,
      "t_rel_ms": 918.5
    },
    {
      "x": 113,
      "y": 546,
      "timestamp": 1782129183675,
      "t_rel_ms": 935.2
    },
    {
      "x": 121,
      "y": 555,
      "timestamp": 1782129183675,
      "t_rel_ms": 951.9
    },
    {
      "x": 115,
      "y": 517,
      "timestamp": 1782129183675,
      "t_rel_ms": 968.6
    },
    {
      "x": 127,
      "y": 534,
      "timestamp": 1782129183675,
      "t_rel_ms": 985.3
    },
    {
      "x": 113,
      "y": 548,
      "timestamp": 1782129183675,
      "t_rel_ms": 1002
    },
    {
      "x": 110,
      "y": 533,
      "timestamp": 1782129183675,
      "t_rel_ms": 1018.7
    },
    {
      "x": 124,
      "y": 536,
      "timestamp": 1782129183675,
      "t_rel_ms": 1035.4
    },
    {
      "x": 109,
      "y": 530,
      "timestamp": 1782129183675,
      "t_rel_ms": 1052.1
    },
    {
      "x": 137,
      "y": 513,
      "timestamp": 1782129183675,
      "t_rel_ms": 1068.8
    },
    {
      "x": 135,
      "y": 536,
      "timestamp": 1782129183675,
      "t_rel_ms": 1085.5
    },
    {
      "x": 114,
      "y": 535,
      "timestamp": 1782129183675,
      "t_rel_ms": 1102.2
    },
    {
      "x": 120,
      "y": 534,
      "timestamp": 1782129183675,
      "t_rel_ms": 1118.9
    },
    {
      "x": 110,
      "y": 544,
      "timestamp": 1782129183675,
      "t_rel_ms": 1135.6
    },
    {
      "x": 112,
      "y": 541,
      "timestamp": 1782129183675,
      "t_rel_ms": 1152.3
    },
    {
      "x": 108,
      "y": 531,
      "timestamp": 1782129183675,
      "t_rel_ms": 1169
    },
    {
      "x": 104,
      "y": 541,
      "timestamp": 1782129183675,
      "t_rel_ms": 1185.7
    },
    {
      "x": 133,
      "y": 552,
      "timestamp": 1782129183675,
      "t_rel_ms": 1202.4
    },
    {
      "x": 122,
      "y": 543,
      "timestamp": 1782129183675,
      "t_rel_ms": 1219.1
    },
    {
      "x": 130,
      "y": 548,
      "timestamp": 1782129183675,
      "t_rel_ms": 1235.8
    },
    {
      "x": 130,
      "y": 551,
      "timestamp": 1782129183675,
      "t_rel_ms": 1252.5
    },
    {
      "x": 117,
      "y": 538,
      "timestamp": 1782129183675,
      "t_rel_ms": 1269.2
    },
    {
      "x": 197,
      "y": 582,
      "timestamp": 1782129183675,
      "t_rel_ms": 1285.9
    },
    {
      "x": 299,
      "y": 578,
      "timestamp": 1782129183675,
      "t_rel_ms": 1302.6
    },
    {
      "x": 290,
      "y": 614,
      "timestamp": 1782129183675,
      "t_rel_ms": 1319.3
    },
    {
      "x": 299,
      "y": 603,
      "timestamp": 1782129183675,
      "t_rel_ms": 1336
    },
    {
      "x": 291,
      "y": 593,
      "timestamp": 1782129183675,
      "t_rel_ms": 1352.7
    },
    {
      "x": 287,
      "y": 592,
      "timestamp": 1782129183675,
      "t_rel_ms": 1369.4
    },
    {
      "x": 287,
      "y": 578,
      "timestamp": 1782129183675,
      "t_rel_ms": 1386.1
    },
    {
      "x": 296,
      "y": 607,
      "timestamp": 1782129183675,
      "t_rel_ms": 1402.8
    },
    {
      "x": 304,
      "y": 607,
      "timestamp": 1782129183675,
      "t_rel_ms": 1419.5
    },
    {
      "x": 297,
      "y": 600,
      "timestamp": 1782129183675,
      "t_rel_ms": 1436.2
    },
    {
      "x": 305,
      "y": 609,
      "timestamp": 1782129183675,